{
  "admission_state": "PENDING_INDEPENDENT_REVIEW",
  "body": {
    "authorized_effects": [
      "fresh_v2_package_root_writes",
      "single_remote_writer_lease_creation_before_package_edits",
      "single_local_package_commit",
      "one_terminal_bridgedb_postflight_receipt_and_required_export",
      "single_bounded_v2_repair_commit_after_blind_review"
    ],
    "bounded_repair": {
      "authorization": "single bounded v2 repair on the existing writer branch",
      "new_branch_or_lease_authorized": false,
      "publication_authorized": false,
      "review_contracts": [
        "019fba52-e027-7240-ae54-a07ac88e8118",
        "019fba52-dac0-7a82-94d5-7e7ae1c536f4"
      ],
      "source_task_id": "019fb643-217f-7971-ac9d-e689aeef3358"
    },
    "bridge_postflight": {
      "attempted_once": true,
      "markdown_export_run": false,
      "outcome": "FAILED_PREWRITE_BOUND_CREDENTIAL_NOT_ENROLLED",
      "receipt_written": false,
      "retry_authorized": false
    },
    "decision": "V2_CONTRACT_APPROVED_FOR_EVIDENCE_PACKAGE_REBUILD_ONLY",
    "normative_adjudicator": {
      "task_id": "019fb993-a5c7-7100-aaa2-a0882d3d0724",
      "terminal": "V2_CONTRACT_APPROVED"
    },
    "not_authorized": [
      "admission",
      "consumer_invocation",
      "baseline_execution",
      "subsequent_push",
      "publication"
    ],
    "operator_messages": [
      {
        "message_item_id": "item-40",
        "source_task_id": "019fb643-217f-7971-ac9d-e689aeef3358",
        "text": "Advance the Evidence Conservation Mutation Pilot into a validation-spec chat, with every other portfolio item held at its current gate.",
        "turn_id": "019fb681-98af-7f51-b1d1-fbd247687a39"
      },
      {
        "message_item_id": "item-49",
        "source_task_id": "019fb643-217f-7971-ac9d-e689aeef3358",
        "text": "Approved",
        "turn_id": "019fb6d4-602d-7b71-90d0-a7c732e73bbe"
      },
      {
        "message_item_id": "item-127",
        "source_task_id": "019fb643-217f-7971-ac9d-e689aeef3358",
        "text": "Allow one-time remote creation of codex/evidence-conservation-v2-package-20260731 as the MCPAudit writer lease. All subsequent commits and outputs remain local-only. Allow one terminal BridgeDB postflight receipt and its required Markdown export after the v2 package commit; no other BridgeDB mutation is authorized.",
        "turn_id": "019fb9b1-5a18-7341-a5c7-ca607a0d25a1"
      }
    ]
  },
  "candidate_state": "READY_FOR_INDEPENDENT_REVIEW",
  "content_sha256": "303de7ee69c25e656bda2a21a841f62cdfbcc0e2db6953e39413f5ce3b802a7c",
  "created_at": "2026-07-31T21:27:04Z",
  "package_id": "20260731-evidence-conservation-v2",
  "prerequisite_state": "SATISFIED",
  "producer": {
    "actor_id": "codex",
    "role": "EVIDENCE_PACKAGE_GENERATOR"
  },
  "record_id": "boundary-decision-v2-20260731",
  "reviews": [],
  "schema": "BoundaryDecisionV1",
  "spec_sha256": "f6f882740f5f4285fb5910ffd963cb7a74af9d67522375d4eef891f25eaf1121"
}
